{
  "schema": 1,
  "name": "Signature — Quadrat",
  "beschreibung": "Quadrat 1080×1080 für Profilansicht, LinkedIn und Facebook. Dunkel, zurueckhaltend, Serifenschrift. Das Bild traegt die ganze Flaeche, ein feiner Rahmen fasst sie.",
  "basis": "signature",
  "format": {
    "breite": 540.0,
    "hoehe": 540.0,
    "ausrichtung": "hoch"
  },
  "stil": {
    "farben": {
      "f1": "ci.primaer",
      "f2": "ci.akzent",
      "ableitung": "signature"
    },
    "schriften": {
      "headline": {
        "familie": "cormorant",
        "schnitt": "Light"
      },
      "text": {
        "familie": "cormorant",
        "schnitt": "Regular"
      },
      "label": {
        "familie": "jakarta",
        "schnitt": "Light"
      }
    },
    "textstile": {
      "marke": {
        "schrift": {
          "familie": "cormorant",
          "schnitt": "Medium"
        },
        "groesse": 19,
        "farbe": "onD",
        "sperrung": 6.0,
        "grossbuchstaben": true,
        "ausrichtung": "mitte",
        "min_groesse": 11
      },
      "marke_zusatz": {
        "schrift": {
          "familie": "jakarta",
          "schnitt": "Light"
        },
        "groesse": 6.4,
        "farbe": "a",
        "sperrung": 4.0,
        "grossbuchstaben": true,
        "ausrichtung": "mitte"
      },
      "pille": {
        "schrift": {
          "familie": "jakarta",
          "schnitt": "Medium"
        },
        "groesse": 7,
        "farbe": "a",
        "sperrung": 3.2,
        "grossbuchstaben": true,
        "ausrichtung": "mitte"
      },
      "bild_label": {
        "schrift": {
          "familie": "jakarta",
          "schnitt": "Light"
        },
        "groesse": 6.4,
        "farbe": "onDm",
        "sperrung": 1.6,
        "grossbuchstaben": true
      },
      "augenbraue": {
        "schrift": {
          "familie": "jakarta",
          "schnitt": "Medium"
        },
        "groesse": 6.8,
        "farbe": "a",
        "sperrung": 3.4,
        "grossbuchstaben": true,
        "ausrichtung": "mitte"
      },
      "titel": {
        "schrift": {
          "familie": "cormorant",
          "schnitt": "Light"
        },
        "groesse": 40,
        "farbe": "onD",
        "sperrung": -0.4,
        "ausrichtung": "mitte",
        "min_groesse": 22
      },
      "titel_zwei": {
        "schrift": {
          "familie": "cormorant",
          "schnitt": "LightItalic"
        },
        "groesse": 40,
        "farbe": "onD",
        "sperrung": -0.4,
        "ausrichtung": "mitte",
        "min_groesse": 22
      },
      "unterzeile": {
        "schrift": {
          "familie": "cormorant",
          "schnitt": "Regular"
        },
        "groesse": 17,
        "farbe": "onDm",
        "ausrichtung": "mitte"
      },
      "preis": {
        "schrift": {
          "familie": "cormorant",
          "schnitt": "Medium"
        },
        "groesse": 24,
        "farbe": "onD",
        "ausrichtung": "mitte"
      },
      "kz_wert": {
        "schrift": {
          "familie": "cormorant",
          "schnitt": "Medium"
        },
        "groesse": 19,
        "farbe": "onD",
        "ausrichtung": "mitte"
      },
      "kz_wert_letzter": {
        "schrift": {
          "familie": "cormorant",
          "schnitt": "Medium"
        },
        "groesse": 19,
        "farbe": "a",
        "ausrichtung": "mitte"
      },
      "kz_label": {
        "schrift": {
          "familie": "jakarta",
          "schnitt": "Light"
        },
        "groesse": 6.0,
        "farbe": "a",
        "sperrung": 2.6,
        "grossbuchstaben": true,
        "ausrichtung": "mitte"
      },
      "punkt": {
        "schrift": {
          "familie": "cormorant",
          "schnitt": "Regular"
        },
        "groesse": 16,
        "farbe": "onD",
        "ausrichtung": "mitte"
      },
      "kontakt_name": {
        "schrift": {
          "familie": "cormorant",
          "schnitt": "Medium"
        },
        "groesse": 22,
        "farbe": "onD",
        "ausrichtung": "mitte"
      },
      "kontakt_zeile": {
        "schrift": {
          "familie": "jakarta",
          "schnitt": "Light"
        },
        "groesse": 10,
        "farbe": "a",
        "sperrung": 1.6,
        "ausrichtung": "mitte"
      },
      "fuss": {
        "schrift": {
          "familie": "jakarta",
          "schnitt": "Light"
        },
        "groesse": 7.4,
        "farbe": "onDm",
        "sperrung": 2.6,
        "grossbuchstaben": true,
        "ausrichtung": "mitte"
      },
      "tab_label": {
        "schrift": {
          "familie": "jakarta",
          "schnitt": "Light"
        },
        "groesse": 8.5,
        "farbe": "a",
        "sperrung": 2.2,
        "grossbuchstaben": true
      },
      "tab_wert": {
        "schrift": {
          "familie": "cormorant",
          "schnitt": "Regular"
        },
        "groesse": 15,
        "farbe": "onD",
        "ausrichtung": "rechts"
      },
      "hl_nummer": {
        "schrift": {
          "familie": "jakarta",
          "schnitt": "Light"
        },
        "groesse": 9,
        "farbe": "a",
        "sperrung": 2.0
      },
      "hl_titel": {
        "schrift": {
          "familie": "cormorant",
          "schnitt": "Medium"
        },
        "groesse": 16,
        "farbe": "onD"
      },
      "hl_text": {
        "schrift": {
          "familie": "jakarta",
          "schnitt": "Light"
        },
        "groesse": 10.5,
        "farbe": "onDm"
      },
      "ap_name": {
        "schrift": {
          "familie": "cormorant",
          "schnitt": "Medium"
        },
        "groesse": 20,
        "farbe": "onD"
      },
      "ap_funktion": {
        "schrift": {
          "familie": "jakarta",
          "schnitt": "Light"
        },
        "groesse": 8.5,
        "farbe": "a",
        "sperrung": 2.6,
        "grossbuchstaben": true
      },
      "ap_label": {
        "schrift": {
          "familie": "jakarta",
          "schnitt": "Light"
        },
        "groesse": 7.5,
        "farbe": "a",
        "sperrung": 1.8,
        "grossbuchstaben": true
      },
      "ap_wert": {
        "schrift": {
          "familie": "jakarta",
          "schnitt": "Light"
        },
        "groesse": 11,
        "farbe": "onD"
      }
    }
  },
  "seiten": [
    {
      "id": "neu",
      "typ": "leer",
      "name": "Neu im Angebot",
      "ohne_fuss": true,
      "elemente": [
        {
          "id": "grund",
          "typ": "form",
          "gesperrt": true,
          "x": 0,
          "y": 0,
          "b": 540.0,
          "h": 540.0,
          "form": "rechteck",
          "fuell": "d"
        },
        {
          "id": "foto",
          "typ": "bild",
          "gesperrt": true,
          "x": 0,
          "y": 0,
          "b": 540.0,
          "h": 528.0,
          "slot": {
            "art": "titelbild"
          },
          "fuellmodus": "cover",
          "platzhalter_farbe": "d"
        },
        {
          "id": "abdunkler",
          "typ": "form",
          "gesperrt": true,
          "x": 0,
          "y": 0,
          "b": 540.0,
          "h": 528.0,
          "form": "scrim",
          "farbe": "schwarz",
          "staerke": 0.82,
          "richtung": "unten"
        },
        {
          "id": "rahmen",
          "typ": "form",
          "gesperrt": true,
          "x": 18,
          "y": 18,
          "b": 504.0,
          "h": 639.0,
          "form": "rechteck",
          "strich": "a",
          "linienbreite": 0.7
        },
        {
          "id": "marke-logo",
          "typ": "bild",
          "x": 50.0,
          "y": 446.0,
          "b": 440,
          "h": 30,
          "slot": {
            "art": "logo",
            "ton": "hell"
          },
          "fuellmodus": "contain",
          "ausrichtung": "mitte",
          "sichtbar_wenn": {
            "vorhanden": "firma.logo.hell"
          }
        },
        {
          "id": "marke",
          "typ": "text",
          "x": 50.0,
          "y": 448.0,
          "b": 440,
          "h": 20,
          "stil": "marke",
          "inhalt": "{{firma.marken_name}}",
          "einzeilig": true,
          "sichtbar_wenn": {
            "nicht": {
              "vorhanden": "firma.logo.hell"
            }
          }
        },
        {
          "id": "marke-strich",
          "typ": "form",
          "gesperrt": true,
          "x": 246.0,
          "y": 436.0,
          "b": 48,
          "h": 0,
          "form": "linie",
          "strich": "a",
          "linienbreite": 0.7,
          "sichtbar_wenn": {
            "nicht": {
              "vorhanden": "firma.logo.hell"
            }
          }
        },
        {
          "id": "marke-zusatz",
          "typ": "text",
          "x": 50.0,
          "y": 418.0,
          "b": 440,
          "h": 7,
          "stil": "marke_zusatz",
          "inhalt": "{{firma.linie?}}",
          "einzeilig": true,
          "sichtbar_wenn": {
            "nicht": {
              "vorhanden": "firma.logo.hell"
            }
          }
        },
        {
          "id": "augenbraue",
          "typ": "text",
          "x": 50,
          "y": 228,
          "b": 440.0,
          "h": 8,
          "stil": "augenbraue",
          "inhalt": "Neu im Angebot  ·  {{objekt.objektart}}",
          "einzeilig": true
        },
        {
          "id": "titel",
          "typ": "text",
          "x": 40,
          "y": 120,
          "b": 460.0,
          "h": 76,
          "stil": "titel",
          "inhalt": "{{objekt.objekttitel}}",
          "zeilenschritt": 44,
          "verdichten": true,
          "max_zeilen": 2
        },
        {
          "id": "trenner",
          "typ": "form",
          "gesperrt": true,
          "x": 242.0,
          "y": 104,
          "b": 56,
          "h": 0,
          "form": "linie",
          "strich": "a",
          "linienbreite": 0.7
        },
        {
          "id": "preis",